{
  "$schema": "https://sethmay.github.io/open-scout-api/schema/v1/training-requirement.schema.json",
  "id": "other-community-board-member-michigan",
  "kind": "training-requirement",
  "position_name": "Community Board Member (Michigan)",
  "registration_codes": [
    "51"
  ],
  "unit_type": "other",
  "requires": [
    {
      "ref": "training:y01-youth-protection-training"
    }
  ],
  "source_document": {
    "title": "Trained Leader Requirements - Unit and Other Positions",
    "url": "https://filestore.scouting.org/filestore/training/pdf/trained_leader_positions.pdf"
  },
  "provenance": {
    "sources": [
      {
        "citation": "Scouting America, Trained Leader Requirements - Unit and Other Positions",
        "url": "https://filestore.scouting.org/filestore/training/pdf/trained_leader_positions.pdf"
      }
    ],
    "method": "curated",
    "verified_at": "2026-07-27",
    "confidence": 0.9,
    "notes": null
  },
  "notes": null
}
