{
  "$schema": "https://sethmay.github.io/open-scout-api/schema/v1/training-requirement.schema.json",
  "id": "troop-scoutmaster",
  "kind": "training-requirement",
  "position_name": "Scoutmaster",
  "registration_codes": [
    "SM"
  ],
  "unit_type": "troop",
  "requires": [
    {
      "ref": "training:y01-youth-protection-training"
    },
    {
      "ref": "training:s11-intro-to-outdoor-leadership-skills"
    },
    {
      "ref": "training:s24-scoutmaster-specific-training"
    }
  ],
  "source_document": {
    "title": "Trained Leader Requirements - Unit and Other Positions",
    "url": "https://filestore.scouting.org/filestore/training/pdf/trained_leader_positions.pdf"
  },
  "provenance": {
    "sources": [
      {
        "citation": "Scouting America, Trained Leader Requirements - Unit and Other Positions",
        "url": "https://filestore.scouting.org/filestore/training/pdf/trained_leader_positions.pdf"
      }
    ],
    "method": "curated",
    "verified_at": "2026-07-27",
    "confidence": 0.9,
    "notes": null
  },
  "notes": null
}
